artist_name,artist_id,genres,followers,img_url,external_url
The Red Chord,3u0I9EqSd1Uo34MItEAIKc,"boston metal, deathcore, deathgrind, grindcore, mathcore, melodic metalcore, technical deathcore",40849,https://i.scdn.co/image/ab6761610000f178b6e9f4935add8930c453a7df,https://open.spotify.com/artist/3u0I9EqSd1Uo34MItEAIKc
Origin,4Mmo0f1kp7dyyH3UbK9vUU,"brutal death metal, cosmic death metal, death metal, deathgrind, technical death metal",70118,https://i.scdn.co/image/ab6761610000f17836dd817f926a802ba1a249d4,https://open.spotify.com/artist/4Mmo0f1kp7dyyH3UbK9vUU
Arsis,7j1diUTtFReVVJxSQG3veO,"american melodeath, brutal death metal, deathgrind, melodic death metal, technical death metal, technical melodic death metal, virginia metal",35452,https://i.scdn.co/image/ab6761610000f1788c03a590ea94be4d422018c8,https://open.spotify.com/artist/7j1diUTtFReVVJxSQG3veO
Through The Eyes of the Dead,7fHM9eaM8o6OMwpyR4xMYn,"deathcore, melodic deathcore, melodic metalcore, south carolina metal",52237,https://i.scdn.co/image/ab6761610000f178e7bb32a5609a202197442995,https://open.spotify.com/artist/7fHM9eaM8o6OMwpyR4xMYn
Molotov Solution,0XwUuXb2vhFXXBMtQ3SJPa,"deathcore, melodic metalcore, progressive deathcore",51665,https://i.scdn.co/image/ab6761610000f178d3cea4c50345b7cc571b6e86,https://open.spotify.com/artist/0XwUuXb2vhFXXBMtQ3SJPa
I Declare War,4Ive5h2zDEYWu32ik078C2,"deathcore, melodic metalcore, progressive deathcore",85131,https://i.scdn.co/image/ab6761610000f178cd0187f383acb798f504ca90,https://open.spotify.com/artist/4Ive5h2zDEYWu32ik078C2
And Hell Followed With,7MnEOC6vXcGp5P8RiFrlCm,"brutal deathcore, deathcore, melodic deathcore, melodic metalcore, progressive deathcore",36548,https://i.scdn.co/image/ab6761610000f178397f7537b2ec604c7eadbf85,https://open.spotify.com/artist/7MnEOC6vXcGp5P8RiFrlCm
Conducting From The Grave,4RwCcFq1OnRF3cRnZVlVp7,"deathcore, melodic deathcore, melodic metalcore",23238,https://i.scdn.co/image/ab67616d00004851bf73be30a92e812cdbbd741e,https://open.spotify.com/artist/4RwCcFq1OnRF3cRnZVlVp7
The Crimson Armada,3goEJ24SHcTW0ZkHcmiaRZ,"christian deathcore, deathcore, melodic deathcore, melodic metalcore",30636,https://i.scdn.co/image/90b8080930887a95fd4ee1ec836dc34c4ecc740b,https://open.spotify.com/artist/3goEJ24SHcTW0ZkHcmiaRZ
Boris The Blade,2A29DtGB7jTFgF7f5rMJja,"australian metal, brutal deathcore, deathcore, melodic metalcore, progressive deathcore",27558,https://i.scdn.co/image/ab6761610000f178387a66d2d6774b65ced28da3,https://open.spotify.com/artist/2A29DtGB7jTFgF7f5rMJja
A Night In Texas,4Fsg1Qph71iuRg07o5rFAS,"deathcore, melodic metalcore, progressive deathcore",54196,https://i.scdn.co/image/ab6761610000f178d8469acb965b1b40208f53fa,https://open.spotify.com/artist/4Fsg1Qph71iuRg07o5rFAS
Suffokate,1z33NUnc0GQ95Id4wVkxaC,"deathcore, melodic deathcore, melodic metalcore",51348,https://i.scdn.co/image/ab67616d0000485191019dcebfd93513410d724f,https://open.spotify.com/artist/1z33NUnc0GQ95Id4wVkxaC
Rose Funeral,5vqNgqz0P61Iipwn7NjT5P,"blackened deathcore, brutal deathcore, deathcore, melodic metalcore, progressive deathcore",42432,https://i.scdn.co/image/ab6761610000f178bf654455bb20c821a2c6a9b3,https://open.spotify.com/artist/5vqNgqz0P61Iipwn7NjT5P
Enterprise Earth,1l3cAmALCtGbjWGVtRwhoh,"brutal deathcore, deathcore, melodic metalcore, progressive deathcore",102917,https://i.scdn.co/image/ab6761610000f178fc466fa75606ed8bb228b8cd,https://open.spotify.com/artist/1l3cAmALCtGbjWGVtRwhoh
Traitors,1GkXxneFQE4d5YTsrbN6Ya,"deathcore, downtempo deathcore, melodic metalcore, metallic hardcore, progressive deathcore, slamming deathcore",64461,https://i.scdn.co/image/ab6761610000f178649ad572ed0d9704d309518e,https://open.spotify.com/artist/1GkXxneFQE4d5YTsrbN6Ya
The Last Ten Seconds of Life,3AESf0xMv9HSc3svVqypnY,"brutal deathcore, deathcore, downtempo deathcore, melodic metalcore, metallic hardcore, progressive deathcore",61052,https://i.scdn.co/image/ab6761610000f178dd7875817fe46e2143d6acd7,https://open.spotify.com/artist/3AESf0xMv9HSc3svVqypnY
Annotations Of An Autopsy,0Bwt1B6EdOHjjOTxlHbtR1,"deathcore, melodic metalcore",40120,https://i.scdn.co/image/ab6761610000f17825e2c3afbdb1ef8e09323c22,https://open.spotify.com/artist/0Bwt1B6EdOHjjOTxlHbtR1
Signs of the Swarm,0yxJx8OEyDfd7dzLsFuNrS,"deathcore, melodic metalcore, pittsburgh metal, progressive deathcore, slamming deathcore",125040,https://i.scdn.co/image/ab6761610000f17833f46519636d3861f52d9da0,https://open.spotify.com/artist/0yxJx8OEyDfd7dzLsFuNrS
Black Tongue,5vTCEZ15eybRnoqUAra4Ys,"blackened deathcore, brutal deathcore, deathcore, downtempo deathcore, melodic metalcore, progressive deathcore",79733,https://i.scdn.co/image/ed4b96b310b3c7e26f92a4af8d2b3d5a2dfec64b,https://open.spotify.com/artist/5vTCEZ15eybRnoqUAra4Ys
A Wake in Providence,60HAu8nsOGLPFtOOvar9wa,"deathcore, progressive deathcore",30839,https://i.scdn.co/image/ab6761610000f1784a782e9254799eb2d56dfa65,https://open.spotify.com/artist/60HAu8nsOGLPFtOOvar9wa
Like Moths To Flames,6RRpZz1uPqY9E28kmSPAhw,"dayton indie, melodic metalcore, metalcore",255074,https://i.scdn.co/image/ab6761610000f17848261374022842ffbd079273,https://open.spotify.com/artist/6RRpZz1uPqY9E28kmSPAhw
If I Were You,64eAZjkDzPIGbBuiANH78Y,"melodic metalcore, metalcore, post-post-hardcore",55530,https://i.scdn.co/image/ab6761610000f178f6f4934e4ee0628a2465633c,https://open.spotify.com/artist/64eAZjkDzPIGbBuiANH78Y
Before I Turn,6oAHBPNjkdXwcdt2AgJgan,"melodic metalcore, metalcore, progressive deathcore, thall",32610,https://i.scdn.co/image/ab6761610000f178c054ca5ac1b243376ddbff93,https://open.spotify.com/artist/6oAHBPNjkdXwcdt2AgJgan
"Our Hollow, Our Home",6zrSK4adBQJaCJuhGNKJEl,"melodic metalcore, metalcore",78963,https://i.scdn.co/image/ab6761610000f178f0fec64f8aaa7da0ac621458,https://open.spotify.com/artist/6zrSK4adBQJaCJuhGNKJEl
The Color Morale,3QHJftSfNb6KIerLVsx7zn,"melodic metalcore, metalcore",138453,https://i.scdn.co/image/ab6761610000f178c59b462707ffca18484ec6f7,https://open.spotify.com/artist/3QHJftSfNb6KIerLVsx7zn
Make Me Famous,3B2zav2zeToujHfMTa7ZB0,trancecore,39475,https://i.scdn.co/image/909a798c7ea25512ec423fc576f8bf81ac138df5,https://open.spotify.com/artist/3B2zav2zeToujHfMTa7ZB0
Feed Her to the Sharks,58r5QdZ8pIIydoNTLcM5eO,"deathcore, melodic metalcore, metalcore",49524,https://i.scdn.co/image/b1feaa4d55cf0d0f842720c91dd210b8c8cedbf4,https://open.spotify.com/artist/58r5QdZ8pIIydoNTLcM5eO
Texas In July,3J5OtMrtDAw0IcanJR28Ya,"christian metalcore, deathcore, melodic metalcore, metalcore",122709,https://i.scdn.co/image/ab6761610000f178ab5ecc657bd42e5c70fa3f9c,https://open.spotify.com/artist/3J5OtMrtDAw0IcanJR28Ya
The Browning,4DSNcg40nf6T3eNAObq1Lo,"deathcore, deathstep, melodic metalcore, metalcore, trancecore",148669,https://i.scdn.co/image/ab6761610000f178b4c045364b204f120791f822,https://open.spotify.com/artist/4DSNcg40nf6T3eNAObq1Lo
For The Fallen Dreams,0rsHKddRhuze38fVL0egOY,"melodic metalcore, metalcore",119302,https://i.scdn.co/image/ab6761610000f1782546d3d675f7520f0a49c481,https://open.spotify.com/artist/0rsHKddRhuze38fVL0egOY
Heart Of A Coward,6GIZRqEJJNx3MFaC1YoFMZ,"djent, melodic metalcore, metalcore, uk metalcore",60692,https://i.scdn.co/image/ab6761610000f178a2a41e6d9adde2fc6627ece2,https://open.spotify.com/artist/6GIZRqEJJNx3MFaC1YoFMZ
InVisions,1QQDWitxJcOcNAivxpuKcR,"melodic metalcore, metalcore, nu-metalcore",39675,https://i.scdn.co/image/ab6761610000f1789799fcb50aeffb19c39ccf67,https://open.spotify.com/artist/1QQDWitxJcOcNAivxpuKcR
SURGEON,2dFTnRb7enPY78wtu7wvSQ,,3555,https://i.scdn.co/image/ab6761610000f17861cd320d4caf23aadcee229b,https://open.spotify.com/artist/2dFTnRb7enPY78wtu7wvSQ
Joshua Travis,0lAkhEiuVXNhO0icEvCstI,,9011,https://i.scdn.co/image/ab6761610000f178b34c4ae055e7f6e5d88ee1ce,https://open.spotify.com/artist/0lAkhEiuVXNhO0icEvCstI
VCTMS,0Gav1syIZzd1D6fiyhd9dT,"deathcore, metallic hardcore, nu-metalcore",41753,https://i.scdn.co/image/ab6761610000f178ac88e6ab912ccb9de98014a4,https://open.spotify.com/artist/0Gav1syIZzd1D6fiyhd9dT
Monasteries,2EaeVm1MjlVtsUV0ebT0vB,"deathcore, metallic hardcore, progressive deathcore",14339,https://i.scdn.co/image/ab6761610000f1780dc6e341ddb59349c9dbb78b,https://open.spotify.com/artist/2EaeVm1MjlVtsUV0ebT0vB
Dealer,0TpKwhxtfxaPTaWsHqpVqP,"australian post-hardcore, deathcore, metallic hardcore, nu-metalcore",57615,https://i.scdn.co/image/ab6761610000f1786dcdc4c24f20470354c88c2a,https://open.spotify.com/artist/0TpKwhxtfxaPTaWsHqpVqP
Darko US,7C6FTHcdowgX4dzKUd678K,"deathcore, melodic metalcore",87502,https://i.scdn.co/image/ab6761610000f1788b2adbd4c191763667eda694,https://open.spotify.com/artist/7C6FTHcdowgX4dzKUd678K
Alpha Wolf,2tjnvrUmP46XNjFh9V0NGc,"australian post-hardcore, deathcore, melodic metalcore, metalcore, nu-metalcore",150177,https://i.scdn.co/image/ab6761610000f17825e561267fcf478c7a3045cf,https://open.spotify.com/artist/2tjnvrUmP46XNjFh9V0NGc
Bodysnatcher,2tCl0ipvwJJRJLAuIGf6tm,"deathcore, downtempo deathcore, melodic metalcore, metallic hardcore, progressive deathcore",84310,https://i.scdn.co/image/ab6761610000f178ac23bf0520f57995d15e934f,https://open.spotify.com/artist/2tCl0ipvwJJRJLAuIGf6tm
Spite,2DynE7m1BMVl4hQMvCXXq0,"deathcore, downtempo deathcore, melodic metalcore, progressive deathcore",113858,https://i.scdn.co/image/ab6761610000f1789e8d15b4d19a8795808e282a,https://open.spotify.com/artist/2DynE7m1BMVl4hQMvCXXq0
Knights Of The Abyss,1UBc8Hb8c54RMdYT2cRonw,"deathcore, melodic deathcore, melodic metalcore",21588,https://i.scdn.co/image/ab6761610000f17884c0a792b36702f709408970,https://open.spotify.com/artist/1UBc8Hb8c54RMdYT2cRonw
The Red Shore,5a1lvPSVcPerhAFNPR7PCw,"deathcore, melodic metalcore, technical deathcore",25494,https://i.scdn.co/image/ab6761610000f178d4a14137d329a85fda6b8f47,https://open.spotify.com/artist/5a1lvPSVcPerhAFNPR7PCw
Arsonists Get All The Girls,24StNQXP5gjZmG95zAZ9KZ,"deathcore, melodic metalcore, nintendocore, trancecore",39025,https://i.scdn.co/image/ab6761610000f1780899bb292270c2c04d274ddb,https://open.spotify.com/artist/24StNQXP5gjZmG95zAZ9KZ
Burning The Masses,3IkHSmNGUPkyrRFIc8Ly83,"brutal deathcore, deathcore, melodic metalcore, technical deathcore",28178,https://i.scdn.co/image/ab67616d000048513778ae39b5bfc09d8494163f,https://open.spotify.com/artist/3IkHSmNGUPkyrRFIc8Ly83
The Black Dahlia Murder,4xTDPgk4jHCF0qui3dH6BS,"american melodeath, deathcore, melodic deathcore, melodic metalcore",329662,https://i.scdn.co/image/ab6761610000f178048a07a10c4594fdcc8153f7,https://open.spotify.com/artist/4xTDPgk4jHCF0qui3dH6BS
Brand of Sacrifice,4d6Rawrese4OLF1zZCztod,"deathcore, melodic metalcore, slamming deathcore, symphonic deathcore",176206,https://i.scdn.co/image/ab6761610000f1780fcf3ab9c4f663f516ecd2ca,https://open.spotify.com/artist/4d6Rawrese4OLF1zZCztod
Left to Suffer,36d1uVy1ZuZWqfnsPxCUOk,"american metalcore, deathcore, melodic metalcore",76119,https://i.scdn.co/image/ab6761610000f178fa6ed8da71c620c7f5e8dfb0,https://open.spotify.com/artist/36d1uVy1ZuZWqfnsPxCUOk
The Air I Breathe,2esri1FQ20U2rQjfC7RA9C,"melodic metalcore, post-post-hardcore, screamo",19556,https://i.scdn.co/image/ab6761610000f17897071986d7f87359a2024ee8,https://open.spotify.com/artist/2esri1FQ20U2rQjfC7RA9C
Adestria,4hbawOk8hcny3O9jtoNPq8,"melodic metalcore, metalcore, post-post-hardcore",35897,https://i.scdn.co/image/fad6b60cd4d7956dafd5aff37a21c090983e75e8,https://open.spotify.com/artist/4hbawOk8hcny3O9jtoNPq8
A Plea for Purging,2KMe9muhC1eg1kQq6veejU,"christian hardcore, christian metal, deathcore, melodic metalcore, tennessee metal",26074,https://i.scdn.co/image/ab6761610000f178055c66d0553f06f45f5ea0f2,https://open.spotify.com/artist/2KMe9muhC1eg1kQq6veejU
For All Eternity,5dAJhja3GDIAnA3YUbI27c,"christian metalcore, melodic metalcore, metalcore",32967,https://i.scdn.co/image/ab6761610000f1785e46a603bfdb6e9484bf031b,https://open.spotify.com/artist/5dAJhja3GDIAnA3YUbI27c
Your Memorial,58Dja9fVx1ptmjkgQlDXwf,"christian metalcore, metalcore",12884,https://i.scdn.co/image/ab6761610000f178468fe1284828f61c29cf51ff,https://open.spotify.com/artist/58Dja9fVx1ptmjkgQlDXwf
Forevermore,1VIF9LpXxJCjFUVoc9LMPB,"christian metal, christian metalcore, progressive metalcore",13547,https://i.scdn.co/image/ab6761610000f178b20c78e84d3b2342e2494ad5,https://open.spotify.com/artist/1VIF9LpXxJCjFUVoc9LMPB
"Oh, Sleeper",3HMsQNXUa0je3yG5REHkQ7,"christian hardcore, christian metal, christian metalcore, melodic metalcore, metalcore",105822,https://i.scdn.co/image/ab6761610000f178ab3f4138a48a410864bc1df5,https://open.spotify.com/artist/3HMsQNXUa0je3yG5REHkQ7
In The Midst Of Lions,7JXvvITCFPtUixT0kxsgCu,"christian deathcore, christian hardcore, christian metal, deathcore",24552,https://i.scdn.co/image/ab6761610000f178d8d4de943c168867ed0760ca,https://open.spotify.com/artist/7JXvvITCFPtUixT0kxsgCu
Onward To Olympas,6L8qlm6sN9urvDB5ol7t5A,"christian metalcore, north carolina metal",10034,https://i.scdn.co/image/ab6761610000f1786606d7a1a75eea992e27f18b,https://open.spotify.com/artist/6L8qlm6sN9urvDB5ol7t5A
Phinehas,1GHGBOI7I9FJfvhJe7e3A0,"christian metal, christian metalcore, melodic metalcore, metalcore",90550,https://i.scdn.co/image/ab6761610000f1780f23d1e088ab9595e04cd529,https://open.spotify.com/artist/1GHGBOI7I9FJfvhJe7e3A0
Those Who Fear,3F7hornn3CDdlCe655yU5N,christian metalcore,11268,https://i.scdn.co/image/ab6761610000f178e52884e5c59fd8e4e1309417,https://open.spotify.com/artist/3F7hornn3CDdlCe655yU5N
For All I Am,458vlrd9XjjCw93UGy1GIz,"electronicore, metalcore, post-post-hardcore, post-screamo",15275,https://i.scdn.co/image/ab6761610000f1784b0b3c51c72c244af7d37b54,https://open.spotify.com/artist/458vlrd9XjjCw93UGy1GIz
Jack Gardiner,68xIMmJbS8ic51vrpfxkSo,progressive jazz fusion,10104,https://i.scdn.co/image/ab6761610000f17864a13fad81ccedfea0c316bf,https://open.spotify.com/artist/68xIMmJbS8ic51vrpfxkSo
The Surrealist,54muyMofzFuDNq0oJfI8Gy,instrumental math rock,21349,https://i.scdn.co/image/ab6761610000f1784e2d42b73b7ff66975fbc8a5,https://open.spotify.com/artist/54muyMofzFuDNq0oJfI8Gy
Waxamilion,7G97Mckd7WAQsjZLUF3vN6,progressive jazz fusion,6786,https://i.scdn.co/image/ab6761610000f178067215924e442b701c0d1f6b,https://open.spotify.com/artist/7G97Mckd7WAQsjZLUF3vN6
Sean Ashe,1686jEZZvNJyZrl8f0LC3J,instrumental rock,5018,https://i.scdn.co/image/ab6761610000f178e6b041d636267396a9d42d68,https://open.spotify.com/artist/1686jEZZvNJyZrl8f0LC3J
Covet,46iJ1VD4HKFnqjISGqlZkV,"instrumental math rock, instrumental rock, math rock",184574,https://i.scdn.co/image/ab6761610000f178c4c5c21a599dc62c41a73f65,https://open.spotify.com/artist/46iJ1VD4HKFnqjISGqlZkV
Strawberry Girls,4CyxMgnF71FyOWADVWxJRE,"math rock, progressive post-hardcore",89103,https://i.scdn.co/image/ab6761610000f17807e508b25e428370ea6104af,https://open.spotify.com/artist/4CyxMgnF71FyOWADVWxJRE
Eternity Forever,57jIhbre5LNTiR4Pr60wUs,progressive post-hardcore,42281,https://i.scdn.co/image/ab67616d0000485161f07169dbfe34f237730698,https://open.spotify.com/artist/57jIhbre5LNTiR4Pr60wUs
TTNG,5TUa95aB5Vu2CzwCnZd6t0,"british math rock, math rock, midwest emo, oxford indie",113411,https://i.scdn.co/image/ab6761610000f178411baea95fcdec24903b6a5c,https://open.spotify.com/artist/5TUa95aB5Vu2CzwCnZd6t0
Yvette Young,502QOcjJiKbhtG2MyrFkc8,"math pop, math rock",102315,https://i.scdn.co/image/ab6761610000f178d7d181c838e6e5621e168e05,https://open.spotify.com/artist/502QOcjJiKbhtG2MyrFkc8
Floral,1FVOt1XlpnaCueBolWF92k,"instrumental math rock, math rock",30104,https://i.scdn.co/image/ab6761610000f17814181afa7c5e394445e567da,https://open.spotify.com/artist/1FVOt1XlpnaCueBolWF92k
Delta Sleep,05MlomiA9La0OiNIAGqECk,"brighton indie, british math rock, math pop, math rock",85909,https://i.scdn.co/image/ab6761610000f178ef86feb3e2b9c57897ddc453,https://open.spotify.com/artist/05MlomiA9La0OiNIAGqECk
Strapping Young Lad,457qPvtiBTIl6LR4dZiKZy,"canadian metal, groove metal, nu metal, progressive metal, vancouver metal",159556,https://i.scdn.co/image/09d929b267663d6131af5a10b6aa346447755fbe,https://open.spotify.com/artist/457qPvtiBTIl6LR4dZiKZy
Decapitated,17MbhJOaaPHuWnRaWU9xkc,"brutal death metal, death metal, deathgrind, groove metal, metal, polish death metal, polish metal, technical death metal, technical groove metal, thrash metal",233072,https://i.scdn.co/image/ab6761610000f178446a1a787b920f8649b6174b,https://open.spotify.com/artist/17MbhJOaaPHuWnRaWU9xkc
Gojira,0GDGKpJFhVpcjIGF8N6Ewt,"alternative metal, french death metal, french metal, groove metal, metal, nu metal, progressive groove metal",1295067,https://i.scdn.co/image/ab6761610000f17896c4949ee078fbef5d5adb68,https://open.spotify.com/artist/0GDGKpJFhVpcjIGF8N6Ewt
Mastodon,1Dvfqq39HxvCJ3GvfeIFuT,"alternative metal, atlanta metal, metal, progressive groove metal, progressive sludge, sludge metal, stoner metal, stoner rock",884675,https://i.scdn.co/image/ab6761610000f178f84fe9e6fbb2aa001d6cbbd9,https://open.spotify.com/artist/1Dvfqq39HxvCJ3GvfeIFuT
Nile,3v3VSKylQE69ztn5TUVlFE,"brutal death metal, death metal, metal, oriental metal, south carolina metal, technical death metal, thrash metal",230896,https://i.scdn.co/image/ab6761610000f178c87c1edbfc3323c5878c53a0,https://open.spotify.com/artist/3v3VSKylQE69ztn5TUVlFE
At The Gates,6YXarbjg36ODFPez0PnOlD,"death metal, gothenburg metal, melodic death metal, metal, swedish death metal, swedish melodeath, swedish metal, thrash metal",234773,https://i.scdn.co/image/ab6761610000f178e05d57f89f3637d01858832f,https://open.spotify.com/artist/6YXarbjg36ODFPez0PnOlD
Opeth,0ybFZ2Ab08V8hueghSXm6E,"alternative metal, metal, progressive death metal, progressive metal, swedish metal, swedish progressive metal",905621,https://i.scdn.co/image/ab6761610000f1783486a950ce048a0020220a3c,https://open.spotify.com/artist/0ybFZ2Ab08V8hueghSXm6E
Cattle Decapitation,67ZMMtA88DDO0gTuRrzGjn,"american grindcore, brutal death metal, death metal, deathcore, deathgrind, goregrind, grindcore, technical death metal, technical grindcore",227226,https://i.scdn.co/image/ab6761610000f178f2ae1471cfed8773fd7160aa,https://open.spotify.com/artist/67ZMMtA88DDO0gTuRrzGjn
Bloodbath,7eYmDBinb760MUIfoRdlGQ,"black metal, brutal death metal, death metal, deathgrind, metal, swedish death metal, swedish metal, technical death metal, thrash metal",198577,https://i.scdn.co/image/ab6761610000f178433f1d31a14a705c82cb0d35,https://open.spotify.com/artist/7eYmDBinb760MUIfoRdlGQ
Worm Shepherd,7hsOYe7y8uBqV4UUsVne73,"blackened deathcore, deathcore, progressive deathcore, symphonic deathcore",29855,https://i.scdn.co/image/ab6761610000f1788bc91703a9a5154fbcd1d4ee,https://open.spotify.com/artist/7hsOYe7y8uBqV4UUsVne73
Distant,7dfpBi0QvO9FmlhBK6XHwJ,"deathcore, downtempo deathcore, slamming deathcore",67502,https://i.scdn.co/image/ab6761610000f17848d82faeda8865cdf2bead12,https://open.spotify.com/artist/7dfpBi0QvO9FmlhBK6XHwJ
CABAL,2bfK6ltXa60B2egnErJvlO,"blackened deathcore, danish hardcore, danish metal, deathcore, progressive deathcore",32851,https://i.scdn.co/image/ab6761610000f178fda6c28394049a863e95db08,https://open.spotify.com/artist/2bfK6ltXa60B2egnErJvlO
Crown Magnetar,0DlST2L7efoM5Lb0uxG3Tx,"deathcore, progressive deathcore, slamming deathcore",32152,https://i.scdn.co/image/ab6761610000f1789346d92ae7e41a505bd87d9c,https://open.spotify.com/artist/0DlST2L7efoM5Lb0uxG3Tx
Mental Cruelty,2iE1NqruxoSxTvOpTCLkE9,"deathcore, downtempo deathcore, slamming deathcore, symphonic deathcore",66529,https://i.scdn.co/image/ab6761610000f178aefad00c68a2a30b624fd906,https://open.spotify.com/artist/2iE1NqruxoSxTvOpTCLkE9
Shrine of Malice,6NPqqqYcR7tAEHL4ORm6pQ,"blackened deathcore, deathcore, downtempo deathcore, progressive deathcore, slamming deathcore, symphonic deathcore",37180,https://i.scdn.co/image/ab6761610000f178782fa7868fe6c682d34abf2c,https://open.spotify.com/artist/6NPqqqYcR7tAEHL4ORm6pQ
Osiah,4zdj6e05Eh8uLVJ6V0V3Mu,"deathcore, progressive deathcore, slamming deathcore",31336,https://i.scdn.co/image/ab6761610000f1780a03b1707854a77affb2cbaf,https://open.spotify.com/artist/4zdj6e05Eh8uLVJ6V0V3Mu
To The Grave,3jr9qsKWQjf3iMNQ3rWVDQ,"blackened deathcore, deathcore, progressive deathcore, slamming deathcore",73564,https://i.scdn.co/image/ab6761610000f1786baa609dc75ab1129f71c26e,https://open.spotify.com/artist/3jr9qsKWQjf3iMNQ3rWVDQ
Mire Lore,0fwNNr5TBw5OVC83CQBySk,"deathcore, progressive deathcore",21579,https://i.scdn.co/image/ab6761610000f17860331496a6e6f14986ae982c,https://open.spotify.com/artist/0fwNNr5TBw5OVC83CQBySk
Hjärna Waves,6g7B8x8K2K4p6bRYUaS5kw,thall,2209,https://i.scdn.co/image/ab6761610000f1786a3cbe7b2b668601afff1015,https://open.spotify.com/artist/6g7B8x8K2K4p6bRYUaS5kw
Indistinct,55jwncjanz31tTNxLqbTd8,"finnish progressive metal, thall",2587,https://i.scdn.co/image/ab6761610000f178daebefaee9d5441b9b7a8f1f,https://open.spotify.com/artist/55jwncjanz31tTNxLqbTd8
Ascera,6h5S54D14qLsqsymfWj1Pz,,1406,https://i.scdn.co/image/ab6761610000f17886bb73c540ab8baf32d50efd,https://open.spotify.com/artist/6h5S54D14qLsqsymfWj1Pz
reg3n,2kfVFOxu5wgPMSXf05ONsw,thall,2275,https://i.scdn.co/image/ab6761610000f178e4c843c32533e6243dbc9f5f,https://open.spotify.com/artist/2kfVFOxu5wgPMSXf05ONsw
Path of Giants,2ZCU5kNKFX8wpsrACl0dTo,progressive deathcore,2081,https://i.scdn.co/image/ab6761610000f178effd78b00c6d6d21ad39faff,https://open.spotify.com/artist/2ZCU5kNKFX8wpsrACl0dTo
Foresthall,3vD08ajndYUFJaD9xGSFkz,,391,https://i.scdn.co/image/ab6761610000f1783a907b4c7584550a3fa15be3,https://open.spotify.com/artist/3vD08ajndYUFJaD9xGSFkz
Catsclaw,7wOW98O5VLYYbJxntYe799,,4085,https://i.scdn.co/image/ab6761610000f1788d75b10d40c1d356f72ebb01,https://open.spotify.com/artist/7wOW98O5VLYYbJxntYe799
Mirar,6g4uwq36brjISbcfehJ7yi,,4378,https://i.scdn.co/image/ab6761610000f1785fcdadf7bc55aa988dbc7e54,https://open.spotify.com/artist/6g4uwq36brjISbcfehJ7yi
Vodník,7kqgDbtbQByAFyT6WpIa7i,,801,https://i.scdn.co/image/ab6761610000f17837071f6e248e53fb4cda427e,https://open.spotify.com/artist/7kqgDbtbQByAFyT6WpIa7i
Coldblood Supplicant,0YoAqHU6UdkoIuQxSSt8QJ,,669,https://i.scdn.co/image/ab6761610000f178a7a83a77d151c4f087bb8e0b,https://open.spotify.com/artist/0YoAqHU6UdkoIuQxSSt8QJ
Aaru,06dVWy6qL3imBpdFy6m5Yv,,2456,https://i.scdn.co/image/ab6761610000f178b1f3aa60c0ad4a94a2fece9a,https://open.spotify.com/artist/06dVWy6qL3imBpdFy6m5Yv
Frostbitt,6XP64Chkji2mFpszEudUkq,thall,5057,https://i.scdn.co/image/ab6761610000f178572c86068da598a7f7b8f993,https://open.spotify.com/artist/6XP64Chkji2mFpszEudUkq
Our Common Collapse,4VTXcebcyltPt1ezdBBMQb,thall,3978,https://i.scdn.co/image/ab6761610000f17832a597ef48f69c600fcdb60e,https://open.spotify.com/artist/4VTXcebcyltPt1ezdBBMQb
and all i can say is,590OxTbe7aKqSDiVV3hAN9,,1889,https://i.scdn.co/image/ab6761610000f17821ac9cedf49c9fa829fc3c40,https://open.spotify.com/artist/590OxTbe7aKqSDiVV3hAN9
Nemertines,5zNVCIEbNc1ngfksGLihx9,"djent, thall",5313,https://i.scdn.co/image/ab6761610000f17812871debc4d88755bcfe61c2,https://open.spotify.com/artist/5zNVCIEbNc1ngfksGLihx9
Olympus Lenticular,0gwVjuAqUxB1TnugpYRqty,instrumental djent,3930,https://i.scdn.co/image/ab6761610000f17824424049be617dc9654ec3b4,https://open.spotify.com/artist/0gwVjuAqUxB1TnugpYRqty
No Oath,1c3B6lj7BUcjM6R3tdTSh2,instrumental djent,8545,https://i.scdn.co/image/ab6761610000f178fb283b81bbfbd0ae2e356820,https://open.spotify.com/artist/1c3B6lj7BUcjM6R3tdTSh2
Harkla,6LE9lW3E48cGM8tk5UGv30,"djent, thall",5594,https://i.scdn.co/image/ab6761610000f178e68700cc391cd405e9cf2a70,https://open.spotify.com/artist/6LE9lW3E48cGM8tk5UGv30
Tulpas,0DKnUxn9UBO2CJNtXKto3W,,1031,https://i.scdn.co/image/ab6761610000f178e2931972624e5887582ba9b1,https://open.spotify.com/artist/0DKnUxn9UBO2CJNtXKto3W
Stömb,25RMuKFF69DTk53XDsD9KH,thall,2999,https://i.scdn.co/image/ab6761610000f178358bdb04ed436fd154f230fd,https://open.spotify.com/artist/25RMuKFF69DTk53XDsD9KH
Koronal,1OLxKLoV5zeXGJc89CVvmZ,thall,1075,https://i.scdn.co/image/ab67616d00004851602fceea738eb2466b4b3980,https://open.spotify.com/artist/1OLxKLoV5zeXGJc89CVvmZ
Omega Virus,3CC8N97VJFhh0xfJX35L6O,"djent, instrumental progressive metal",5657,https://i.scdn.co/image/ab6761610000f1780ab47f252b20c265fb360ab4,https://open.spotify.com/artist/3CC8N97VJFhh0xfJX35L6O
One Decade,1U3iq1PnQjCTqJcBhpsnRm,instrumental djent,5638,https://i.scdn.co/image/ab6761610000f178100b7239ae9778c6b10c8f14,https://open.spotify.com/artist/1U3iq1PnQjCTqJcBhpsnRm
Cilice,7rw5ubXn8L3puUi7zODoe5,djent,3595,https://i.scdn.co/image/ab67616d0000485147f5ac73a415261620244907,https://open.spotify.com/artist/7rw5ubXn8L3puUi7zODoe5
Means End,67EIzC886kyRGhip66It7d,"djent, swedish progressive metal, thall",2938,https://i.scdn.co/image/ab6761610000f1785e58ce0d804dc3adcaabbc3e,https://open.spotify.com/artist/67EIzC886kyRGhip66It7d
Elision,4kkoqDos9OB9xzO07DiiJf,australian metalcore,6178,https://i.scdn.co/image/ab6761610000f17886dd534c40000d4ba0c20fd3,https://open.spotify.com/artist/4kkoqDos9OB9xzO07DiiJf
HEAVENSGATE,5xxpBuljNlb95kr6fcf6hj,,8074,https://i.scdn.co/image/ab6761610000f178b1c420a89d457ce87a924a83,https://open.spotify.com/artist/5xxpBuljNlb95kr6fcf6hj
Atlas,33BnCqtsMZSw7LlPBwzmmH,finnish metalcore,15242,https://i.scdn.co/image/ab6761610000f1788b7eff205406f0c8ef08c74e,https://open.spotify.com/artist/33BnCqtsMZSw7LlPBwzmmH
Grayscale Season,7vkn8n6j3FIOVuRmVVYzA4,swedish metalcore,6063,https://i.scdn.co/image/ab6761610000f1781bb3369525038902df58873e,https://open.spotify.com/artist/7vkn8n6j3FIOVuRmVVYzA4
Half Me,4LNvQot1CDYC3kWGW144XC,"german metalcore, metalcore",14978,https://i.scdn.co/image/ab6761610000f1785957d9645f28652238330f9b,https://open.spotify.com/artist/4LNvQot1CDYC3kWGW144XC
LUNE,4Fg9wlaoqD9IMyyWpOAtws,australian metalcore,6173,https://i.scdn.co/image/ab6761610000f1783cfe685f605294c296512b08,https://open.spotify.com/artist/4Fg9wlaoqD9IMyyWpOAtws
Darkmatter,6eftKndDms3JdNUfvzo7Fu,,6708,https://i.scdn.co/image/ab6761610000f178919f6ccb52e2c8a9e2a84fc1,https://open.spotify.com/artist/6eftKndDms3JdNUfvzo7Fu
