artist_name,artist_id,genres,followers,img_url,external_url
Periphery,6d24kC5fxHFOSEAmjQPPhc,"djent, melodic metalcore, progressive metal, progressive metalcore",485291,https://i.scdn.co/image/ab6761610000f178ae2304891734b9d9fafe1c8d,https://open.spotify.com/artist/6d24kC5fxHFOSEAmjQPPhc
Monuments,71IBhhBhtPLZ8OyVuXOw77,"djent, melodic metalcore, metalcore",159341,https://i.scdn.co/image/ab6761610000f178bb2c29ee05c6d734c4470dac,https://open.spotify.com/artist/71IBhhBhtPLZ8OyVuXOw77
TesseracT,23ytwhG1pzX6DIVWRWvW1r,"djent, progressive metal",311473,https://i.scdn.co/image/ab6761610000f178e7f6346ac85070065ea2368d,https://open.spotify.com/artist/23ytwhG1pzX6DIVWRWvW1r
The Contortionist,7nCgNmfYJcsVy3vOOzExYS,"djent, sci-fi metal",173105,https://i.scdn.co/image/ab6761610000f178472e002e5e613a22a83c7f8f,https://open.spotify.com/artist/7nCgNmfYJcsVy3vOOzExYS
Veil Of Maya,2i7CQcVBh2K6uOR3CH09M1,"deathcore, djent, melodic metalcore, metalcore, technical deathcore",285406,https://i.scdn.co/image/ab6761610000f1789f7d65d7aa5ca1c3d23b72fa,https://open.spotify.com/artist/2i7CQcVBh2K6uOR3CH09M1
Intervals,0xpJGyjbEzkWSNfcf2tcMl,"djent, instrumental djent, instrumental rock",195074,https://i.scdn.co/image/ab6761610000f17800a456b082157f4bd1882f52,https://open.spotify.com/artist/0xpJGyjbEzkWSNfcf2tcMl
Animals As Leaders,65C6Unk7nhg2aCnVuAPMo8,"djent, instrumental djent, instrumental rock, jazz metal, progressive jazz fusion, progressive metal",522029,https://i.scdn.co/image/ab6761610000f178720141a7b1a39da1cfa735a5,https://open.spotify.com/artist/65C6Unk7nhg2aCnVuAPMo8
Vildhjarta,0z4ODfFM8PGE0A9r0tZ75J,"djent, instrumental djent, thall",115522,https://i.scdn.co/image/ab6761610000f1782229f7eb4f07adad3419ca59,https://open.spotify.com/artist/0z4ODfFM8PGE0A9r0tZ75J
Haunted Shores,6Zebs0nwJt4EUs36wgFisx,"djent, instrumental rock",35685,https://i.scdn.co/image/ab6761610000f178d7a88ad8da2ef9d6849bce73,https://open.spotify.com/artist/6Zebs0nwJt4EUs36wgFisx
ERRA,2UoOdQyBGyzrEfxcY77ce0,"alabama metal, djent, melodic metalcore, metalcore, progressive metalcore",256658,https://i.scdn.co/image/ab6761610000f178706b4eb4746d2bfe6943de3e,https://open.spotify.com/artist/2UoOdQyBGyzrEfxcY77ce0
Born Of Osiris,4HgqjpBaWctBWVHafQIpRt,"deathcore, djent, melodic deathcore, melodic metalcore, metalcore, progressive metalcore, symphonic deathcore",319696,https://i.scdn.co/image/ab6761610000f1785dea11e3aff7891d1dc61d32,https://open.spotify.com/artist/4HgqjpBaWctBWVHafQIpRt
Between The Buried And Me,2JC4hZm1egeJDEolLsMwZ9,"djent, melodic metalcore, north carolina metal, progressive metal",265251,https://i.scdn.co/image/ab6761610000f17887fc314a9b6b9f18e6e32278,https://open.spotify.com/artist/2JC4hZm1egeJDEolLsMwZ9
Volumes,1DgmdsnwOexqTH8ohPCFAU,"deathcore, djent, melodic metalcore, metalcore, progressive metalcore",178286,https://i.scdn.co/image/ab6761610000f1785dec0f59ba6ebbc09f3311d2,https://open.spotify.com/artist/1DgmdsnwOexqTH8ohPCFAU
Protest The Hero,6z3BjfmgvDUIHaJ0UPTtrQ,"canadian metal, canadian post-hardcore, djent",198720,https://i.scdn.co/image/ab6761610000f1788df5e7ad475aeaaa865a54fe,https://open.spotify.com/artist/6z3BjfmgvDUIHaJ0UPTtrQ
Textures,6v9XKyEf4HKmUMr3D6weIO,"djent, dutch metal, progressive metal",68918,https://i.scdn.co/image/ab6761610000f178d2f6590d005aa373503e2fa4,https://open.spotify.com/artist/6v9XKyEf4HKmUMr3D6weIO
Skyharbor,0YbvZPP1HufDyWIsR0ei6K,"djent, indian metal",60966,https://i.scdn.co/image/ab6761610000f178303fee91dcecb34bbe33d63c,https://open.spotify.com/artist/0YbvZPP1HufDyWIsR0ei6K
After The Burial,0uNj4RxFjG0iVPlZS753en,"deathcore, djent, melodic metalcore, metalcore, minneapolis metal, progressive metalcore",296743,https://i.scdn.co/image/ab6761610000f178c9baa5bb3289f30bcb3363c9,https://open.spotify.com/artist/0uNj4RxFjG0iVPlZS753en
SikTh,03mz3G1gu1GPNgAWY4qR2w,djent,68627,https://i.scdn.co/image/ab6761610000f17869bd9c38c4edc3ef1736c649,https://open.spotify.com/artist/03mz3G1gu1GPNgAWY4qR2w
Bulb,2VD2tCp2pxWqsguRJUsSCB,djent,22146,https://i.scdn.co/image/ab6761610000f1789afc0ebf8a196aafeb62f101,https://open.spotify.com/artist/2VD2tCp2pxWqsguRJUsSCB
Plini,3Gs10XJ4S4OEFrMRqZJcic,"djent, instrumental math rock, instrumental rock, progressive jazz fusion",307713,https://i.scdn.co/image/ab6761610000f1787db8f5ef63701ec561a2109c,https://open.spotify.com/artist/3Gs10XJ4S4OEFrMRqZJcic
Jason Richardson,4fsZkYcSEUEvZK2tEjzrVY,"djent, shred",68165,https://i.scdn.co/image/ab6761610000f1782206b7175b3e2969d3c5c869,https://open.spotify.com/artist/4fsZkYcSEUEvZK2tEjzrVY
Uneven Structure,6ncfp4E8TXGnp6nYwBUwwj,"djent, thall",38692,https://i.scdn.co/image/ab67616d000048519c587d9f110d79646dad47d3,https://open.spotify.com/artist/6ncfp4E8TXGnp6nYwBUwwj
Kadinja,1MQvxiK7o7mpgtQM33l2F1,djent,29638,https://i.scdn.co/image/ab6761610000f178e7b378608273a14281c6144b,https://open.spotify.com/artist/1MQvxiK7o7mpgtQM33l2F1
Anup Sastry,0sCAofrHFyDFPxXA0B7a86,"djent, electronic djent, instrumental djent, instrumental rock",47429,https://i.scdn.co/image/ab67616d0000485153aa479fe9452dd195acc561,https://open.spotify.com/artist/0sCAofrHFyDFPxXA0B7a86
Circles,64j43wsW2L0NunoKT5wbKd,djent,26429,https://i.scdn.co/image/ab6761610000f178e39b4eee4c8406c11b475a1b,https://open.spotify.com/artist/64j43wsW2L0NunoKT5wbKd
Flux Conduct,2dfis6Lubbjjejzgm9FZ20,djent,10963,https://i.scdn.co/image/ab67616d00004851df233198d2ac9b7a24191683,https://open.spotify.com/artist/2dfis6Lubbjjejzgm9FZ20
Shokran,1DHGS6S7X2lF4cgEa9ErqC,"djent, russian metalcore",65415,https://i.scdn.co/image/ab6761610000f17844e239ee3b7b4a17f964af53,https://open.spotify.com/artist/1DHGS6S7X2lF4cgEa9ErqC
Modern Day Babylon,1KkwPJo8M1KmVs5qSlkxAa,"djent, instrumental djent, instrumental progressive metal",42075,https://i.scdn.co/image/ab67616d000048510e5e3a89c684deb132a7c97c,https://open.spotify.com/artist/1KkwPJo8M1KmVs5qSlkxAa
The HAARP Machine,2ziusta0GEeyx669s2Zmhg,djent,23768,https://i.scdn.co/image/ab6761610000f178a6fa72f444228e125d75bdc7,https://open.spotify.com/artist/2ziusta0GEeyx669s2Zmhg
Ghost Iris,0OG1DoaGFeeXGYBGbbCjka,"djent, metalcore, progressive metalcore",32764,https://i.scdn.co/image/ab6761610000f1781cf6323d6974da80618ed4db,https://open.spotify.com/artist/0OG1DoaGFeeXGYBGbbCjka
Olly Steele,2nqc3t3HgV2IyPEBkZg5ls,"djent, instrumental djent",17194,https://i.scdn.co/image/ab6761610000f17899bc9358da7852a71824200c,https://open.spotify.com/artist/2nqc3t3HgV2IyPEBkZg5ls
"Time, The Valuator",5XMVfR85CUqujqUkN9c9VQ,"djent, german metalcore",41945,https://i.scdn.co/image/ab6761610000f178d6013867e857742e3392d3ee,https://open.spotify.com/artist/5XMVfR85CUqujqUkN9c9VQ
Structures,7ym3CMfXJCuyIMf60Vm9Wm,"canadian metal, canadian metalcore, deathcore, djent, melodic metalcore, metalcore",51585,https://i.scdn.co/image/ab6761610000f178baf29fcc8dcc6f432551343b,https://open.spotify.com/artist/7ym3CMfXJCuyIMf60Vm9Wm
VOLA,1HQjBwlj8FSHMhVaNQ4tEI,"djent, progressive alternative, progressive metal",85825,https://i.scdn.co/image/ab6761610000f1780c9372f85a19d13a547f86f7,https://open.spotify.com/artist/1HQjBwlj8FSHMhVaNQ4tEI
Caligula's Horse,6Zd7AjXsoLaweP9FHyudVC,"djent, progressive metal",95444,https://i.scdn.co/image/ab6761610000f178fecee2debceb0d3c09f77827,https://open.spotify.com/artist/6Zd7AjXsoLaweP9FHyudVC
Earthside,6mRDRKsNautYuxybddnvgg,"djent, progressive metal",43125,https://i.scdn.co/image/ab6761610000f178cfe2006f0b5ffb4046477425,https://open.spotify.com/artist/6mRDRKsNautYuxybddnvgg
Scale The Summit,16Uqo1jjtPiKI4zU1Ficgb,"djent, instrumental math rock, instrumental progressive metal, instrumental rock, progressive jazz fusion",100813,https://i.scdn.co/image/ab6761610000f178c4e7dc0721948ff89cc014cd,https://open.spotify.com/artist/16Uqo1jjtPiKI4zU1Ficgb
David Maxim Micic,0wQa1N4q3HmLwxqkpVcYhs,djent,79845,https://i.scdn.co/image/ab6761610000f1786b134374297a469269e5323b,https://open.spotify.com/artist/0wQa1N4q3HmLwxqkpVcYhs
Haken,2SRIVGDkdqQnrQdaXxDkJt,progressive metal,209852,https://i.scdn.co/image/ab6761610000f178709c28ab620aff25f7584281,https://open.spotify.com/artist/2SRIVGDkdqQnrQdaXxDkJt
Leprous,4lgrzShsg2FLA89UM2fdO5,"norwegian metal, prog metal, progressive metal",241778,https://i.scdn.co/image/ab6761610000f1781039c96a8100bdeb579126af,https://open.spotify.com/artist/4lgrzShsg2FLA89UM2fdO5
Destiny Potato,67BmW9levzg3b6U3NWZKSB,djent,53270,https://i.scdn.co/image/ab67616d000048513e592560ea791e455c24caf3,https://open.spotify.com/artist/67BmW9levzg3b6U3NWZKSB
Good Tiger,4vIQLq68LtKcCjdvhobTYl,"djent, progressive post-hardcore",59189,https://i.scdn.co/image/ab6761610000f178b858139544e0051196915421,https://open.spotify.com/artist/4vIQLq68LtKcCjdvhobTYl
The Safety Fire,0IbaScpUWE6Wboz4o6X7xG,djent,26955,https://i.scdn.co/image/ab67616d000048511efce8d74fc8357479ebe7b9,https://open.spotify.com/artist/0IbaScpUWE6Wboz4o6X7xG
Corelia,2qZIkmNOwY6Z6fkhcqTRJB,djent,28330,https://i.scdn.co/image/ab67616d00004851882349befae771c3daddecef,https://open.spotify.com/artist/2qZIkmNOwY6Z6fkhcqTRJB
Mestís,3adhzSHzVWN1ICfxIqO9Cn,"djent, jazz metal, progressive jazz fusion",46883,https://i.scdn.co/image/ab6761610000f178ec4f65c16737797da4bf09d2,https://open.spotify.com/artist/3adhzSHzVWN1ICfxIqO9Cn
Disperse,2srZF49xeqWbN9srRp4JI6,djent,23902,https://i.scdn.co/image/ab6761610000f178f57556b83fa0af0c49da4d97,https://open.spotify.com/artist/2srZF49xeqWbN9srRp4JI6
The Faceless,1FQ6uth7icR6Jhla16K2vC,"avant-garde metal, brutal death metal, cosmic death metal, deathcore, djent, melodic metalcore, sci-fi metal, technical death metal, technical deathcore",136346,https://i.scdn.co/image/ab6761610000f178c348b98a839dd55941cd8a36,https://open.spotify.com/artist/1FQ6uth7icR6Jhla16K2vC
The Helix Nebula,5tjE7fMmvRra46r6Hz3aOA,"australian metal, djent, instrumental djent, instrumental rock",41015,https://i.scdn.co/image/ab67616d00004851a8d3579b47edc658f075ba48,https://open.spotify.com/artist/5tjE7fMmvRra46r6Hz3aOA
Within The Ruins,5mscNJ6lE9Kj7tWv4iCk7y,"deathcore, djent, melodic metalcore, metalcore",132604,https://i.scdn.co/image/ab6761610000f178099c302b31d002f7e155827c,https://open.spotify.com/artist/5mscNJ6lE9Kj7tWv4iCk7y
Oceano,79A0IUxQD9skV7LVjPq53s,"deathcore, djent, melodic metalcore, metalcore",165586,https://i.scdn.co/image/ab6761610000f178b818bf25b45f7af469bdec58,https://open.spotify.com/artist/79A0IUxQD9skV7LVjPq53s
Oceans Ate Alaska,48zUWAXpgEXfpttz23pCNQ,"melodic metalcore, metalcore, progressive metalcore, uk metalcore",181499,https://i.scdn.co/image/ab6761610000f1783e5e9262f4d4fae5e00371b3,https://open.spotify.com/artist/48zUWAXpgEXfpttz23pCNQ
Betraying The Martyrs,4tEWLl4loWFLgs25trNnro,"deathcore, melodic metalcore, metalcore, symphonic deathcore",147598,https://i.scdn.co/image/ab6761610000f178a71c65a2899dcb2c73facc0f,https://open.spotify.com/artist/4tEWLl4loWFLgs25trNnro
Reflections,0DTH9zFyvRb24bb8XN0iEr,"deathcore, djent, melodic metalcore, metalcore, progressive deathcore, progressive metalcore, thall",52320,https://i.scdn.co/image/ab6761610000f178222ddd2e4dc7382a3a3ab9b6,https://open.spotify.com/artist/0DTH9zFyvRb24bb8XN0iEr
Invent Animate,3ALVPmg5sZexSVD2m9atEt,"american metalcore, djent, melodic metalcore, metalcore, progressive metalcore",132861,https://i.scdn.co/image/ab6761610000f178923f7d48177dd572f2648086,https://open.spotify.com/artist/3ALVPmg5sZexSVD2m9atEt
The Acacia Strain,4tDkeVxH0CSkNiLVrsYmQs,"deathcore, downtempo deathcore, melodic metalcore, metalcore",190804,https://i.scdn.co/image/ab6761610000f178a8bace0a018f74648c03a241,https://open.spotify.com/artist/4tDkeVxH0CSkNiLVrsYmQs
As Blood Runs Black,4LjQpQc5NB5G02zqfEIex7,"deathcore, melodic deathcore, melodic metalcore, metalcore",137430,https://i.scdn.co/image/8c06678e4365e02ecf0ea80ad6e5bd6f1c41aabc,https://open.spotify.com/artist/4LjQpQc5NB5G02zqfEIex7
All Shall Perish,7GkGdNLPzWw4e6ctwKvI2x,"deathcore, melodic deathcore, melodic metalcore, metalcore",181355,https://i.scdn.co/image/ab6761610000f178fd691a6e8c8e5ba55c727ed8,https://open.spotify.com/artist/7GkGdNLPzWw4e6ctwKvI2x
Make Them Suffer,0FZcPgWI3BsFQl4rOAGSHT,"australian metalcore, blackened deathcore, brutal deathcore, deathcore, melodic deathcore, melodic metalcore, metalcore, symphonic deathcore",252168,https://i.scdn.co/image/ab6761610000f178919ca818e5d5236acad1d269,https://open.spotify.com/artist/0FZcPgWI3BsFQl4rOAGSHT
I The Breather,6OpFzG0Srh37pwJUdwsETa,"christian metalcore, deathcore, melodic metalcore, metalcore",53076,https://i.scdn.co/image/ab6761610000f178b77fe0fbeba8801d224f3a47,https://open.spotify.com/artist/6OpFzG0Srh37pwJUdwsETa
Sithu Aye,6AOvXKqmqmZHxqdop7Kzoh,"djent, instrumental djent, progressive jazz fusion, scottish metal",72062,https://i.scdn.co/image/ab6761610000f17802760ad9480b8ae78db60b88,https://open.spotify.com/artist/6AOvXKqmqmZHxqdop7Kzoh
Arch Echo,4ilweWzFHh6vrr7OOuDcUh,"djent, instrumental rock, progressive jazz fusion",55481,https://i.scdn.co/image/ab6761610000f1789b4602ff36c8f528e6cc26d4,https://open.spotify.com/artist/4ilweWzFHh6vrr7OOuDcUh
I Built the Sky,4URPAJlk8ay7npvNVVLpKN,"djent, instrumental djent, instrumental progressive metal",53520,https://i.scdn.co/image/ab6761610000f17807771ebe081a3a0550f8b22b,https://open.spotify.com/artist/4URPAJlk8ay7npvNVVLpKN
Vitalism,7aBLyeKiEpyPfFpkfoLVRZ,"brazilian progressive metal, djent, instrumental djent, instrumental rock",69443,https://i.scdn.co/image/ab6761610000f1787e31923a40e676c3c20f3d53,https://open.spotify.com/artist/7aBLyeKiEpyPfFpkfoLVRZ
Jakub Zytecki,43EA0mCA9Iiw33kdPtMa1q,"djent, instrumental rock, one-person band",53089,https://i.scdn.co/image/ab6761610000f1786b6e6a969b9bba3cd68b65cd,https://open.spotify.com/artist/43EA0mCA9Iiw33kdPtMa1q
Owane,2LkMP01m9PIf5r87iC0HI2,"djent, progressive jazz fusion",42356,https://i.scdn.co/image/ab6761610000f1786de178407eae41ebed633469,https://open.spotify.com/artist/2LkMP01m9PIf5r87iC0HI2
Pomegranate Tiger,30T39voTL4EiHKGNE0mQxO,"djent, instrumental djent, instrumental math rock, instrumental rock",34459,https://i.scdn.co/image/ab6761610000f178b2cbe9751a7680bdf58cdd2a,https://open.spotify.com/artist/30T39voTL4EiHKGNE0mQxO
Chon,2JFljHPanIjYy2QqfNYvC0,"instrumental math rock, instrumental rock, progressive jazz fusion, san diego indie",310144,https://i.scdn.co/image/ab6761610000f17877585e787d20e88c7e5fbc8c,https://open.spotify.com/artist/2JFljHPanIjYy2QqfNYvC0
Meshuggah,3ggwAqZD3lyT2sbovlmfQY,"alternative metal, djent, groove metal, metal, nu metal, progressive groove metal, swedish metal, technical groove metal, technical thrash",679949,https://i.scdn.co/image/ab6761610000f1782198c33d521ca13e0204b789,https://open.spotify.com/artist/3ggwAqZD3lyT2sbovlmfQY
Cloudkicker,4DAuhWUSCvn4FFcVpgIqY6,"djent, instrumental rock",72551,https://i.scdn.co/image/ab6761610000f178ebea64dadbf505f01977ad5c,https://open.spotify.com/artist/4DAuhWUSCvn4FFcVpgIqY6
Humanity's Last Breath,7nKz8GVqHk0bUGmBm6wm3E,"brutal deathcore, deathcore, djent, melodic metalcore, symphonic deathcore, thall",90209,https://i.scdn.co/image/ab6761610000f178420e82b73a1a0ce237d114ab,https://open.spotify.com/artist/7nKz8GVqHk0bUGmBm6wm3E
Stoort Neer,49nlcaQ7gAunXS6OZLDGl4,"djent, thall",5567,https://i.scdn.co/image/ab67616d00004851090b21c4d16d396dc26219e3,https://open.spotify.com/artist/49nlcaQ7gAunXS6OZLDGl4
Fractalize,1WmHqBnzUgQG04GEljKVKk,"djent, thall",12789,https://i.scdn.co/image/ab67616d00004851795f7a897eea2b71cd2fc9bc,https://open.spotify.com/artist/1WmHqBnzUgQG04GEljKVKk
Fellsilent,40rX3FZRnC6p7k7ds1MPff,djent,14489,https://i.scdn.co/image/ab67616d00004851f2b71e5e33679225cc17d9d1,https://open.spotify.com/artist/40rX3FZRnC6p7k7ds1MPff
Allt,6YRr0btzGqfQ5K7r23qjEM,"progressive metalcore, swedish metalcore",23307,https://i.scdn.co/image/ab6761610000f178e85e45e0e70c3fd20ef06f0e,https://open.spotify.com/artist/6YRr0btzGqfQ5K7r23qjEM
The Dali Thundering Concept,6HZqdaj8X8h6gMTPlD6EPR,djent,22362,https://i.scdn.co/image/ab6761610000f1782cc0ef973f76830ed0843c53,https://open.spotify.com/artist/6HZqdaj8X8h6gMTPlD6EPR
Fallujah,3C5R32AIZlLfMa3uxLEYrU,"blackened deathcore, brutal deathcore, death metal, deathcore, djent, melodic metalcore, technical death metal, technical deathcore",81187,https://i.scdn.co/image/ab6761610000f178db33ad6cc2dcde1c84ab2344,https://open.spotify.com/artist/3C5R32AIZlLfMa3uxLEYrU
Car Bomb,5r1fQsxkiQl0VwUlERnDBP,"american metalcore, avant-garde metal, djent, mathcore",61877,https://i.scdn.co/image/ab67616d0000485102817738bfc59f3f7f81665b,https://open.spotify.com/artist/5r1fQsxkiQl0VwUlERnDBP
Glass Cloud,31FeV95p1uS4qVjd8yEHJf,"deathcore, djent, melodic metalcore, progressive metalcore",34046,https://i.scdn.co/image/7b41d0759abf6ff3d6b0f6a1e273cbfacf0cddff,https://open.spotify.com/artist/31FeV95p1uS4qVjd8yEHJf
Jake Bowen,5S1qHHFKZRXRC4qjiPXyzN,djent,9173,https://i.scdn.co/image/ab6761610000f1786cb4dcb6ee0ce520b4772000,https://open.spotify.com/artist/5S1qHHFKZRXRC4qjiPXyzN
Four Seconds Ago,2M2WQWmzbs4p6voVnmCk9c,djent,9503,https://i.scdn.co/image/ab6761610000f178b2ad7492afe769ed946eb512,https://open.spotify.com/artist/2M2WQWmzbs4p6voVnmCk9c
King Mothership,3UCGy1PmryuULJlbe23F6g,,9416,https://i.scdn.co/image/ab6761610000f178c38d8c44e225078958b1a729,https://open.spotify.com/artist/3UCGy1PmryuULJlbe23F6g
Chimp Spanner,1luumZojARx0L3spmNwEgl,"djent, instrumental djent, instrumental rock",31940,https://i.scdn.co/image/ab6761610000f17842c7ade6649465f41fb5fab7,https://open.spotify.com/artist/1luumZojARx0L3spmNwEgl
Stephen Taranto,1Hjr3351EqOHTlR09x8Dk6,"djent, progressive jazz fusion, shred",13149,https://i.scdn.co/image/ab6761610000f17831c8a84f4b4ac7ba97dba960,https://open.spotify.com/artist/1Hjr3351EqOHTlR09x8Dk6
Alluvial,7z2P2nNjtnAVnUavHIXZWQ,"djent, instrumental death metal, portland metal, technical death metal",36448,https://i.scdn.co/image/ab6761610000f1782ecf93c92d42293cd7fa9e19,https://open.spotify.com/artist/7z2P2nNjtnAVnUavHIXZWQ
Ever Forthright,13D2d4O3SXaCtDgVn3AbgX,djent,10445,https://i.scdn.co/image/ab6761610000f17894b5cd8b6c5599dac57f2798,https://open.spotify.com/artist/13D2d4O3SXaCtDgVn3AbgX
NOVELISTS,6o8sDniHcZPM1SixvjKiYS,"djent, melodic metalcore, metalcore",95622,https://i.scdn.co/image/ab6761610000f17844cf1eaffed99aefdd3bf950,https://open.spotify.com/artist/6o8sDniHcZPM1SixvjKiYS
Northlane,3qyg72RGnGdF521zMU02u9,"australian metalcore, djent, melodic metalcore, metalcore, nu-metalcore, progressive metalcore",333471,https://i.scdn.co/image/ab6761610000f178d9c867dccd8d28f082090ac8,https://open.spotify.com/artist/3qyg72RGnGdF521zMU02u9
Kingdom Of Giants,77rcxvpDqP78d90dL3DNNe,"melodic metalcore, metalcore, post-post-hardcore",99057,https://i.scdn.co/image/ab6761610000f1783df0e400d7a76bf9fd5d403f,https://open.spotify.com/artist/77rcxvpDqP78d90dL3DNNe
Hollow Front,50YmW8f4U5IxTIwYI9mGAe,"american metalcore, melodic metalcore, metalcore",83969,https://i.scdn.co/image/ab6761610000f1786e394602f82631a106541adb,https://open.spotify.com/artist/50YmW8f4U5IxTIwYI9mGAe
Silent Planet,0JGTiwfinlCuANGu4Gq2XU,"christian metalcore, melodic metalcore, metalcore, progressive metalcore",166724,https://i.scdn.co/image/ab6761610000f17885ffd133b82ebf688dc5f443,https://open.spotify.com/artist/0JGTiwfinlCuANGu4Gq2XU
Currents,5pqvAI85RMxL9K0xHvSwGu,"melodic metalcore, metalcore, progressive deathcore",217038,https://i.scdn.co/image/ab6761610000f178e802e9f9a66d1c2b90992780,https://open.spotify.com/artist/5pqvAI85RMxL9K0xHvSwGu
Aviana,1AvLltBsz1HdAtZeucm9zy,"melodic metalcore, metalcore, swedish metalcore",66344,https://i.scdn.co/image/ab6761610000f178c3c080f66fc51645393bdc5e,https://open.spotify.com/artist/1AvLltBsz1HdAtZeucm9zy
Ghost Atlas,67fzMHDSmWInaFqolzknKn,"post-screamo, progressive post-hardcore",48583,https://i.scdn.co/image/ab6761610000f178bc1c8f0354a9f7251eac3edb,https://open.spotify.com/artist/67fzMHDSmWInaFqolzknKn
Polaris,0v2e0oznnTaIXKLGKHphfX,"australian metalcore, australian post-hardcore, melodic metalcore, metalcore",294069,https://i.scdn.co/image/ab6761610000f1788cc500e7483d02c27f89a12e,https://open.spotify.com/artist/0v2e0oznnTaIXKLGKHphfX
In Hearts Wake,30BDCIM0IdglDaLzvCYd0N,"australian metalcore, melodic metalcore, metalcore",130433,https://i.scdn.co/image/ab6761610000f1785c0fc255ee9b8e3ba120bc1a,https://open.spotify.com/artist/30BDCIM0IdglDaLzvCYd0N
Thornhill,2dE5audbkV3o5cKxvM7lBD,"australian metalcore, australian post-hardcore, metalcore",112194,https://i.scdn.co/image/ab6761610000f178df6d51fcd7c90750d2d72db3,https://open.spotify.com/artist/2dE5audbkV3o5cKxvM7lBD
Void Of Vision,7bpJe59fkklnlfHPxCMvF1,"australian metalcore, australian post-hardcore, metalcore",51206,https://i.scdn.co/image/ab6761610000f178bc53b00f3544e1a75d2638d2,https://open.spotify.com/artist/7bpJe59fkklnlfHPxCMvF1
Crystal Lake,0A7d0PJxaLO7CGI94ht6PX,"japanese metalcore, japanese punk rock, melodic metalcore, metalcore",192201,https://i.scdn.co/image/ab6761610000f178588220aa312bb6d2bc68c603,https://open.spotify.com/artist/0A7d0PJxaLO7CGI94ht6PX
Winds of Plague,080xIP1qfuknBNYEYPuH1v,"blackened deathcore, deathcore, melodic metalcore, metalcore, symphonic deathcore",113938,https://i.scdn.co/image/ab6761610000f178239581de4beade5b5681ea2e,https://open.spotify.com/artist/080xIP1qfuknBNYEYPuH1v
Rings of Saturn,67Zm35qXdPzYfl1c3M0toJ,"cosmic death metal, deathcore, melodic metalcore, technical deathcore",211492,https://i.scdn.co/image/ab6761610000f178e791288a54759d10dff6c950,https://open.spotify.com/artist/67Zm35qXdPzYfl1c3M0toJ
Job For A Cowboy,5L3QTPofDwMPGlNnQkyHK1,"deathcore, melodic metalcore, metalcore",236100,https://i.scdn.co/image/ab6761610000f1785e02af9ce185e6baac215072,https://open.spotify.com/artist/5L3QTPofDwMPGlNnQkyHK1
Aversions Crown,6OITsYO1BqjC0VIF6yGFOc,"australian metal, blackened deathcore, brutal deathcore, deathcore, melodic metalcore, progressive deathcore, symphonic deathcore",84156,https://i.scdn.co/image/ab6761610000f178b7477bc3b1634be23382a9e8,https://open.spotify.com/artist/6OITsYO1BqjC0VIF6yGFOc
Carnifex,4nqY8hkQNkHaDq4fdVxdYr,"blackened deathcore, deathcore, melodic metalcore, metalcore, symphonic deathcore",239959,https://i.scdn.co/image/ab6761610000f1783aec3c508de574c201b10c4d,https://open.spotify.com/artist/4nqY8hkQNkHaDq4fdVxdYr
Despised Icon,3MjNMjqBpaQ0P8ebfbZjYn,"canadian metal, deathcore, melodic metalcore",125819,https://i.scdn.co/image/ab6761610000f17879ae990f5125a06b7a6dc465,https://open.spotify.com/artist/3MjNMjqBpaQ0P8ebfbZjYn
Breakdown of Sanity,20reGZ0TQPGvwx5U4xx6D8,"deathcore, melodic metalcore, metalcore, swiss metal",126143,https://i.scdn.co/image/ab6761610000f1781b94c6aa773536d169a0ca6e,https://open.spotify.com/artist/20reGZ0TQPGvwx5U4xx6D8
Whitechapel,5274obTQJjzjyycRyJlfml,"deathcore, melodic metalcore, metalcore, nu metal, tennessee metal",523005,https://i.scdn.co/image/ab6761610000f17898f8af4615dfad2a2fdd2222,https://open.spotify.com/artist/5274obTQJjzjyycRyJlfml
Upon A Burning Body,1bPBx2qbpWzEoLujeHC3G7,"deathcore, melodic metalcore, metalcore, texas metal",244303,https://i.scdn.co/image/ab6761610000f178e58e58535713cb7f408bc8e7,https://open.spotify.com/artist/1bPBx2qbpWzEoLujeHC3G7
Fit For An Autopsy,0qJpY7K8p7g6sacvaGNt6i,"brutal deathcore, deathcore, melodic metalcore, metalcore",201466,https://i.scdn.co/image/ab6761610000f178e150a6da573d24e141e474fb,https://open.spotify.com/artist/0qJpY7K8p7g6sacvaGNt6i
Chelsea Grin,4UgQ3EFa8fEeaIEg54uV5b,"deathcore, melodic metalcore, metalcore",485816,https://i.scdn.co/image/ab6761610000f178a35b8b41564f07d64feb0d41,https://open.spotify.com/artist/4UgQ3EFa8fEeaIEg54uV5b
The Human Abstract,2SDGIFzEh9xmE5zDKcMRkj,"deathcore, djent, melodic metalcore, progressive metalcore",50084,https://i.scdn.co/image/ab6761610000f17832624a0f638be381c13a2a7d,https://open.spotify.com/artist/2SDGIFzEh9xmE5zDKcMRkj
The Dillinger Escape Plan,7IGcjaMGAtsvKBLQX26W4i,"american metalcore, mathcore, new jersey hardcore, new jersey punk, post-hardcore, post-metal",246447,https://i.scdn.co/image/ab6761610000f178fb994f3ad1f2a58320e9b422,https://open.spotify.com/artist/7IGcjaMGAtsvKBLQX26W4i
Thomas Giles,2Zw1EFe4lg5AnxlJ3pOvvN,,14184,https://i.scdn.co/image/ab6761610000f1786f3149e73badc2175164b873,https://open.spotify.com/artist/2Zw1EFe4lg5AnxlJ3pOvvN
Intronaut,17qfMEjKb5ry8L8mekQZfd,"atmospheric post-metal, djent, jazz metal, post-metal, sludge metal",64937,https://i.scdn.co/image/e08154f61c856226e18cc2c53d38f623d0f80750,https://open.spotify.com/artist/17qfMEjKb5ry8L8mekQZfd
Cynic,5nXldeedEas60jZnMi40p4,"djent, florida death metal, jazz metal, miami metal, progressive metal, technical death metal",114689,https://i.scdn.co/image/ab6761610000f178a246792b94fd9640975ba8d4,https://open.spotify.com/artist/5nXldeedEas60jZnMi40p4
Native Construct,0qI8ZUA0wp1W5Y2vkhgfNX,"djent, jazz metal, progressive metal",33026,https://i.scdn.co/image/ab6761610000f178edd803309802b99c58d52a23,https://open.spotify.com/artist/0qI8ZUA0wp1W5Y2vkhgfNX
The Ocean,6fuALtryzj4cq7vkglKLxq,"atmospheric post-metal, atmospheric sludge, djent, post-metal, progressive metal, progressive sludge, sludge metal",131315,https://i.scdn.co/image/ab6761610000f17841af56b46833309d41575b2b,https://open.spotify.com/artist/6fuALtryzj4cq7vkglKLxq
The Tony Danza Tapdance Extravaganza,54ZsHhYWjJ3cc14rux5CjE,"american grindcore, american metalcore, deathcore, djent, mathcore, melodic metalcore, tennessee metal",60701,https://i.scdn.co/image/ab67616d00004851778c0a7dfe8db5c234643123,https://open.spotify.com/artist/54ZsHhYWjJ3cc14rux5CjE
Elitist,08q7eHwauUxjMODBdbbYpa,"djent, melodic metalcore, metalcore, progressive metalcore",26713,https://i.scdn.co/image/ab6761610000f178519d0554325fdf27816150cc,https://open.spotify.com/artist/08q7eHwauUxjMODBdbbYpa
The Afterimage,71KlAA3CCNxxRI8WCyy1G7,"djent, metalcore, progressive metalcore",27294,https://i.scdn.co/image/ab67616d00004851e310887334f1b62a77d0dbc1,https://open.spotify.com/artist/71KlAA3CCNxxRI8WCyy1G7
